{"_type":"export","__export_format":4,"__export_date":"2025-02-24T09:15:14.952Z","__export_source":"insomnia.desktop.app:v10.3.0","resources":[{"_id":"req_0cf8ae42090f4d6685df82a6b9617e31","parentId":"fld_b664cc60147748769fdd86c8362f8a24","modified":1740388289569,"created":1740388289569,"url":"/{{base_url}}/users/{user_id}/publications","name":"List user publications","description":"","method":"GET","body":{},"parameters":[{"name":"page","value":"1","disabled":false},{"name":"perPage","value":"10","disabled":false},{"name":"order","value":"title","disabled":false},{"name":"direction","value":"asc","disabled":false}],"headers":[],"authentication":{},"preRequestScript":"","metaSortKey":-1740388287707,"isPrivate":false,"afterResponseScript":"","settingStoreCookies":true,"settingSendCookies":true,"settingDisableRenderRequestBody":false,"settingEncodeUrl":true,"settingRebuildPath":true,"settingFollowRedirects":"global","_type":"request"},{"_id":"fld_b664cc60147748769fdd86c8362f8a24","parentId":"fld_43c3efe5cff340af9a340f11255a837e","modified":1740388289568,"created":1740388289568,"name":"Publications","description":"","environment":{},"environmentPropertyOrder":null,"metaSortKey":-1740388287708,"preRequestScript":"console.log('pre-request publications');","afterResponseScript":"console.log('post-response publications');","authentication":{"type":"bearer","disabled":false,"token":"publications-endpoint-token","prefix":""},"_type":"request_group"},{"_id":"fld_43c3efe5cff340af9a340f11255a837e","parentId":"fld_ede9d696298946779ee264e1d1beae38","modified":1740388289567,"created":1740388289567,"name":"Users","description":"","environment":{},"environmentPropertyOrder":null,"metaSortKey":-1740388287709,"preRequestScript":"","afterResponseScript":"","authentication":{},"_type":"request_group"},{"_id":"fld_ede9d696298946779ee264e1d1beae38","parentId":"wrk_46d11a3500ef4f118a974e6c494c6242","modified":1740388289565,"created":1740388289565,"name":"Test Collection","description":"","environment":{},"environmentPropertyOrder":null,"metaSortKey":-1740388287710,"preRequestScript":"","afterResponseScript":"","authentication":{},"_type":"request_group"},{"_id":"wrk_46d11a3500ef4f118a974e6c494c6242","parentId":null,"modified":1740388289561,"created":1740388289561,"name":"Test Collection","description":"","scope":"collection","_type":"workspace"},{"_id":"req_8e4f3bea424a4489b08a72c8c93d6bcf","parentId":"fld_b664cc60147748769fdd86c8362f8a24","modified":1740388289571,"created":1740388289571,"url":"/{{base_url}}/users/{user_id}/publications/{publication_id}","name":"Show user publication","description":"","method":"GET","body":{},"parameters":[],"headers":[],"authentication":{},"preRequestScript":"","metaSortKey":-1740388287706,"isPrivate":false,"afterResponseScript":"","settingStoreCookies":true,"settingSendCookies":true,"settingDisableRenderRequestBody":false,"settingEncodeUrl":true,"settingRebuildPath":true,"settingFollowRedirects":"global","_type":"request"},{"_id":"req_d7330e9f5f35435f826090d4c87a93b4","parentId":"fld_43c3efe5cff340af9a340f11255a837e","modified":1740388289572,"created":1740388289572,"url":"/{{base_url}}/users","name":"List users","description":"","method":"GET","body":{},"parameters":[],"headers":[],"authentication":{},"preRequestScript":"","metaSortKey":-1740388287705,"isPrivate":false,"afterResponseScript":"","settingStoreCookies":true,"settingSendCookies":true,"settingDisableRenderRequestBody":false,"settingEncodeUrl":true,"settingRebuildPath":true,"settingFollowRedirects":"global","_type":"request"},{"_id":"req_b04cfd0ecd884a16a76e1bb92da818d5","parentId":"fld_43c3efe5cff340af9a340f11255a837e","modified":1740388289572,"created":1740388289572,"url":"/{{base_url}}/users","name":"Create user","description":"","method":"POST","body":{"mimeType":"application/json","text":"{\n    \"name\": \"Howard P. Lovecraft\",\n    \"email\": \"howard@miskatonic.edu\",\n    \"department\": \"History and mythology\",\n    \"password\": \"cthulhu1900\"\n}"},"parameters":[],"headers":[{"name":"Content-Type","value":"application/json"}],"authentication":{},"preRequestScript":"","metaSortKey":-1740388287704,"isPrivate":false,"afterResponseScript":"","settingStoreCookies":true,"settingSendCookies":true,"settingDisableRenderRequestBody":false,"settingEncodeUrl":true,"settingRebuildPath":true,"settingFollowRedirects":"global","_type":"request"},{"_id":"req_6006a1b40f1849ebaefad633a1b7ccfa","parentId":"fld_43c3efe5cff340af9a340f11255a837e","modified":1740388289573,"created":1740388289573,"url":"/{{base_url}}/users/{user_id}","name":"Show user","description":"","method":"GET","body":{},"parameters":[],"headers":[],"authentication":{},"preRequestScript":"","metaSortKey":-1740388287703,"isPrivate":false,"afterResponseScript":"","settingStoreCookies":true,"settingSendCookies":true,"settingDisableRenderRequestBody":false,"settingEncodeUrl":true,"settingRebuildPath":true,"settingFollowRedirects":"global","_type":"request"},{"_id":"req_a502eb90b4de4510b0592130f4175472","parentId":"fld_ede9d696298946779ee264e1d1beae38","modified":1740388289574,"created":1740388289574,"url":"/simple","name":"Simple GET Request","description":"","method":"GET","body":{},"parameters":[],"headers":[{"name":"x-api-key","value":"foo","description":"Custom Api Key"},{"name":"x-device","value":"12345678909876543210","description":"Session device uuid"}],"authentication":{},"preRequestScript":"","metaSortKey":-1740388287702,"isPrivate":false,"afterResponseScript":"","settingStoreCookies":true,"settingSendCookies":true,"settingDisableRenderRequestBody":false,"settingEncodeUrl":true,"settingRebuildPath":true,"settingFollowRedirects":"global","_type":"request"},{"_id":"req_e381a3740bdc4bc5b842febb786eb833","parentId":"fld_ede9d696298946779ee264e1d1beae38","modified":1740388289574,"created":1740388289574,"url":"/{{base_url}}/authenticated","name":"Authenticated POST Request","description":"","method":"POST","body":{},"parameters":[],"headers":[],"authentication":{"type":"bearer","disabled":false,"token":"test-bearer-token","prefix":""},"preRequestScript":"","metaSortKey":-1740388287701,"isPrivate":false,"afterResponseScript":"","settingStoreCookies":true,"settingSendCookies":true,"settingDisableRenderRequestBody":false,"settingEncodeUrl":true,"settingRebuildPath":true,"settingFollowRedirects":"global","_type":"request"},{"_id":"env_eb52917cac1ebecef009de38defd68b63efbac42","parentId":"wrk_46d11a3500ef4f118a974e6c494c6242","modified":1740388364056,"created":1740388291747,"name":"Base Environment","data":{"base_url":"http://localhost:8081"},"dataPropertyOrder":null,"color":null,"isPrivate":false,"metaSortKey":1740388291747,"environmentType":"json","kvPairData":[],"_type":"environment"},{"_id":"jar_eb52917cac1ebecef009de38defd68b63efbac42","parentId":"wrk_46d11a3500ef4f118a974e6c494c6242","modified":1740388291748,"created":1740388291748,"name":"Default Jar","cookies":[],"_type":"cookie_jar"},{"_id":"env_021bc4b8e9374b1b9858e456feefbdca","parentId":"env_eb52917cac1ebecef009de38defd68b63efbac42","modified":1740388465678,"created":1740388426202,"name":"Cartographer","data":{"base_url":"http://localhost:8081"},"dataPropertyOrder":null,"color":"#09bfd7","isPrivate":false,"metaSortKey":1740388426202,"environmentType":"kv","kvPairData":[{"id":"envPair_2d196fe2a6b34962b6a63aea3915b2db","name":"base_url","value":"http://localhost:8081","type":"str","enabled":true}],"_type":"environment"}]}